Brand,Category,Original Title,Quality,Lap-Pop Price,Trust-EG Price,Allewaa Price,Minimum Market Price,Suggested Selling Price,Generic Title
Msi,Cable,تاتش باد لاب توب MSI GS60 – متوافق مع الموديلات GS60 2QD، 6QE، MS-16H5، و MS-16H7 – لوحة لمس أصلية تشمل الكابل – رقم القطعة S783700830,Standard/Copy,1195.0,N/A,N/A,1195.0,1135.25,16h5 16h7 2qd 6qe gs60 gs60 ms ms msi s783700830 أصلية القطعة الكابل الموديلات باد تاتش تشمل رقم لمس لوحة متوافق مع و
Generic/Unknown,Cable,ديسك ويسترن ديجيتال SSD خارجي 1 تيرا - WD Elements 1tb SSD External Solid State Drive - USB 3.0 cable - WDBAYN0010BBK-WESN | ضمان سنة,Standard/Copy,N/A,5250.0,N/A,5250.0,4987.5,0 1 1tb 3 cable drive elements external solid ssd ssd state usb wd wdbayn0010bbk wesn تيرا خارجي ديجيتال ديسك سنة ضمان ويسترن
Dell,Cable,فلاتة توصيل أصلية لتاتش باد Dell Inspiron 7590/7591 و Vostro 7590 – رقم القطعة V84RD,Standard/Copy,495.0,N/A,N/A,495.0,470.25,7590 7590 7591 dell inspiron v84rd vostro أصلية القطعة باد توصيل رقم فلاتة لتاتش و
Lenovo,Cable,فلاتة توصيل أصلية لتاتش باد Lenovo IdeaPad L340-15 / IdeaPad 3-15 – رقم القطعة NBX0001SB10,Standard/Copy,495.0,N/A,N/A,495.0,470.25,15 15 3 ideapad ideapad l340 lenovo nbx0001sb10 أصلية القطعة باد توصيل رقم فلاتة لتاتش
Lenovo,Cable,فلاتة توصيل أصلية لتاتش باد Lenovo Y50-70 / Y50-80 – رقم القطعة NBX0002KZ00,Standard/Copy,495.0,N/A,N/A,495.0,470.25,70 80 lenovo nbx0002kz00 y50 y50 أصلية القطعة باد توصيل رقم فلاتة لتاتش
Lenovo,Cable,فلاتة توصيل أصلية للـ Motherboard Lenovo IdeaPad 3 15IGL05 – رقم القطعة NBX0001SA10,Standard/Copy,495.0,N/A,N/A,495.0,470.25,15igl05 3 ideapad lenovo motherboard nbx0001sa10 أصلية القطعة توصيل رقم فلاتة للـ
Generic/Unknown,Cable,فلاتة زرار باور ديل أصلية لـ Vostro 3501 / Inspiron 5593 – Power Button Cable – رقم القطعة TP06J,Standard/Copy,495.0,N/A,N/A,495.0,470.25,3501 5593 button cable inspiron power tp06j vostro أصلية القطعة باور ديل رقم زرار فلاتة لـ
Dell,Cable,فلاتة سلك واي فاي ديل أصلي – Genuine Dell G5 5590 Wi-Fi Cable 1415-06W10DR Antennas,Original,895.0,N/A,N/A,895.0,850.25,06w10dr 1415 5590 antennas cable dell fi g5 genuine wi أصلي ديل سلك فاي فلاتة واي
Dell,Cable,فلاتة سلك واي فاي ديل أصلي – Genuine Dell Inspiron 5570/3582/3593 و Latitude 3590/E3590 Wi-Fi Cable DC330021T0L Antennas,Original,895.0,N/A,N/A,895.0,850.25,3582 3590 3593 5570 antennas cable dc330021t0l dell e3590 fi genuine inspiron latitude wi أصلي ديل سلك فاي فلاتة و واي
Dell,Cable,فلاتة سلك واي فاي ديل أصلي – Genuine Dell Inspiron 5584 Wi-Fi Antennas Cable – رقم القطعة 025.901GP.0011,Original,895.0,N/A,N/A,895.0,850.25,0011 025 5584 901gp antennas cable dell fi genuine inspiron wi أصلي القطعة ديل رقم سلك فاي فلاتة واي
Dell,Cable,فلاتة سلك واي فاي ديل أصلي – Genuine Dell Latitude 7490 / Precision 3520 WLAN Cable رقم القطعة A176D9 – DC33001TQ00,Original,1495.0,N/A,N/A,1495.0,1420.25,3520 7490 a176d9 cable dc33001tq00 dell genuine latitude precision wlan أصلي القطعة ديل رقم سلك فاي فلاتة واي
Generic/Unknown,Cable,فلاتة سلك واي فاي ديل أصلية لجهاز Vostro 3501 / Inspiron 5593 / 3505 – رقم القطعة DC33002CD1L / DC33002CD2L FDI55 Antennas,Standard/Copy,895.0,N/A,N/A,895.0,850.25,3501 3505 5593 antennas dc33002cd1l dc33002cd2l fdi55 inspiron vostro أصلية القطعة ديل رقم سلك فاي فلاتة لجهاز واي
Dell,Cable,فلاتة سلك واي فاي ديل أصلية – Genuine Dell Latitude 3510 Wi-Fi Cable 025.901MS.0011 Antennas – رقم البارت 025.901MS.0011,Original,895.0,N/A,N/A,895.0,850.25,0011 0011 025 025 3510 901ms 901ms antennas cable dell fi genuine latitude wi أصلية البارت ديل رقم سلك فاي فلاتة واي
Lenovo,Cable,فلاتة سلك واي فاي لينوفو Compatible Lenovo IdeaPad 320 / 330 Wi-Fi Wire Cable + Wireless Antennas – رقم القطعة DC33001GN10,Standard/Copy,895.0,N/A,N/A,895.0,850.25,320 330 antennas cable dc33001gn10 fi ideapad lenovo wi wire wireless القطعة رقم سلك فاي فلاتة لينوفو واي
Lenovo,Cable,فلاتة سلك واي فاي لينوفو Compatible Lenovo Z50-70 / G50-70 Wi-Fi Wire Cable + Wireless Antennas – رقم القطعة DC330017J00 / DC330017J10,Standard/Copy,895.0,N/A,N/A,895.0,850.25,70 70 antennas cable dc330017j00 dc330017j10 fi g50 lenovo wi wire wireless z50 القطعة رقم سلك فاي فلاتة لينوفو واي
Lenovo,Cable,فلاتة سلك واي فاي لينوفو Genuine Lenovo IdeaPad 510-15ISK Wireless Cable AUX MAIN Antenna – رقم القطعة DC33001F200,Original,895.0,N/A,N/A,895.0,850.25,15isk 510 antenna aux cable dc33001f200 genuine ideapad lenovo main wireless القطعة رقم سلك فاي فلاتة لينوفو واي
Lenovo,Cable,فلاتة سلك واي فاي لينوفو أصلي – Genuine Lenovo Legion S7 15IMH5 / Y750s Wireless Antennas Wi-Fi Wire رقم القطعة 1109-05479,Original,1695.0,N/A,N/A,1695.0,1610.25,05479 1109 15imh5 antennas fi genuine legion lenovo s7 wi wire wireless y750s أصلي القطعة رقم سلك فاي فلاتة لينوفو واي
Generic/Unknown,Cable,فلاتة سلك واي فاي لينوفو لجهاز Legion 5 15IMH05 / 15IMH05H / 15ARH05H / 15ARH05 GY550 – رقم القطعة DC33001N800,Standard/Copy,1495.0,N/A,N/A,1495.0,1420.25,15arh05 15arh05h 15imh05 15imh05h 5 dc33001n800 gy550 legion القطعة رقم سلك فاي فلاتة لجهاز لينوفو واي
